{
  "schema_version": "1.0.0",
  "id": "en.grammar.orientation_how_to_read.subject_verb_object_in",
  "section_id": "en.grammar.orientation_how_to_read",
  "title": "Subject / verb / object in practice (no heavy terminology)",
  "title_short": "Subject / verb / object in practice",
  "description": "Практическое введение в базовую структуру английского предложения: подлежащее, сказуемое и дополнение. Обучение без сложной терминологии, с фокусом на практическое применение.",
  "ui_language": "ru",
  "target_language": "en",
  "level": "A1",
  "order": 0,
  "prerequisites": [],
  "concept_refs": [
    "sentence_structure_svo",
    "subject_identification",
    "verb_identification",
    "object_identification",
    "svo_practice"
  ],
  "learning_objectives": [
    "Научиться определять подлежащее, сказуемое и дополнение в простых английских предложениях",
    "Понять базовую структуру английского предложения на практике",
    "Применять знания для построения собственных простых предложений"
  ],
  "estimated_minutes": 15,
  "blocks": [
    {
      "id": "b1_theory_basic_structure",
      "type": "theory",
      "title": "Каждое английское предложение имеет базовую структуру: кто делает что. Это три главные части:",
      "theory": {
        "concept_id": "sentence_structure_svo",
        "content_md": "Каждое английское предложение имеет базовую структуру: **кто делает что**. Это три главные части:\n\n1. **Подлежащее** (Subject) — кто или что выполняет действие\n2. **Сказуемое** (Verb) — само действие\n3. **Дополнение** (Object) — на что направлено действие\n\nНе все предложения имеют дополнение, но подлежащее и сказуемое есть почти всегда.",
        "key_points": [
          "Английское предложение = кто делает что",
          "Подлежащее отвечает на вопрос 'кто?' или 'что?'",
          "Сказуемое показывает действие или состояние",
          "Дополнение показывает, на что направлено действие"
        ],
        "common_mistakes": [
          {
            "wrong": "Пропуск подлежащего: 'Is a student'",
            "right": "В английском всегда нужно подлежащее: 'He is a student'",
            "why": "В английском языке подлежащее обязательно, в отличие от русского"
          },
          {
            "wrong": "Неправильный порядок: 'Book reads she'",
            "right": "Правильный порядок: 'She reads a book'",
            "why": "В английском строгий порядок слов: подлежащее → сказуемое → дополнение"
          }
        ],
        "examples": [
          {
            "id": "ex1",
            "text": "I read a book.",
            "translation": "Я читаю книгу.",
            "notes": "I (подлежащее) → read (сказуемое) → a book (дополнение)",
            "tags": [
              "affirmative",
              "svo"
            ]
          },
          {
            "id": "ex2",
            "text": "She likes coffee.",
            "translation": "Она любит кофе.",
            "notes": "She (подлежащее) → likes (сказуемое) → coffee (дополнение)",
            "tags": [
              "affirmative",
              "svo"
            ]
          },
          {
            "id": "ex3",
            "text": "He doesn't like tea.",
            "translation": "Он не любит чай.",
            "notes": "He (подлежащее) → doesn't like (сказуемое) → tea (дополнение)",
            "tags": [
              "negative",
              "svo"
            ]
          },
          {
            "id": "ex4",
            "text": "Do you speak English?",
            "translation": "Ты говоришь по-английски?",
            "notes": "you (подлежащее) → speak (сказуемое) → English (дополнение)",
            "tags": [
              "question",
              "svo"
            ]
          },
          {
            "id": "ex5",
            "text": "They play football.",
            "translation": "Они играют в футбол.",
            "notes": "They (подлежащее) → play (сказуемое) → football (дополнение)",
            "tags": [
              "affirmative",
              "svo"
            ]
          },
          {
            "id": "ex6",
            "text": "We don't watch TV.",
            "translation": "Мы не смотрим телевизор.",
            "notes": "We (подлежащее) → don't watch (сказуемое) → TV (дополнение)",
            "tags": [
              "negative",
              "svo"
            ]
          }
        ]
      }
    },
    {
      "id": "b2_quiz_after_basic_structure",
      "type": "quiz_inline",
      "title": "Быстрая проверка: понимаете ли вы базовую структуру?",
      "quiz_inline": {
        "question_ids": [
          "q1",
          "q2",
          "q3",
          "q4",
          "q5"
        ],
        "show_answers_immediately": true
      }
    },
    {
      "id": "b2_theory_subject",
      "type": "theory",
      "title": "Подлежащее — это главная часть предложения, которая отвечает на вопросы «кто?» или «что?». Оно показывает, кто или что выполняет действие.",
      "theory": {
        "concept_id": "subject_identification",
        "content_md": "**Подлежащее** — это главная часть предложения, которая отвечает на вопросы «кто?» или «что?». Оно показывает, кто или что выполняет действие.\n\nПодлежащее обычно стоит в начале предложения (перед сказуемым). Это может быть:\n- Местоимение: I, you, he, she, it, we, they\n- Существительное: Tom, book, students\n- Имя собственное: Mary, London",
        "key_points": [
          "Подлежащее отвечает на вопрос 'кто?' или 'что?'",
          "Обычно стоит в начале предложения",
          "Может быть местоимением, существительным или именем собственным",
          "В английском подлежащее обязательно"
        ],
        "common_mistakes": [
          {
            "wrong": "Пропуск подлежащего: 'Is my friend'",
            "right": "Всегда нужен субъект: 'He is my friend'",
            "why": "В английском языке подлежащее обязательно, даже если в русском его можно опустить"
          }
        ],
        "examples": [
          {
            "id": "ex1",
            "text": "I am a teacher.",
            "translation": "Я учитель.",
            "notes": "I — подлежащее (кто?)",
            "tags": [
              "affirmative",
              "subject"
            ]
          },
          {
            "id": "ex2",
            "text": "Tom works here.",
            "translation": "Том работает здесь.",
            "notes": "Tom — подлежащее (кто?)",
            "tags": [
              "affirmative",
              "subject"
            ]
          },
          {
            "id": "ex3",
            "text": "The book is interesting.",
            "translation": "Книга интересная.",
            "notes": "The book — подлежащее (что?)",
            "tags": [
              "affirmative",
              "subject"
            ]
          },
          {
            "id": "ex4",
            "text": "She doesn't know.",
            "translation": "Она не знает.",
            "notes": "She — подлежащее (кто?)",
            "tags": [
              "negative",
              "subject"
            ]
          },
          {
            "id": "ex5",
            "text": "Do they speak English?",
            "translation": "Они говорят по-английски?",
            "notes": "they — подлежащее (кто?)",
            "tags": [
              "question",
              "subject"
            ]
          },
          {
            "id": "ex6",
            "text": "Students study hard.",
            "translation": "Студенты усердно учатся.",
            "notes": "Students — подлежащее (кто?)",
            "tags": [
              "affirmative",
              "subject"
            ]
          }
        ]
      }
    },
    {
      "id": "b3_quiz_after_subject",
      "type": "quiz_inline",
      "title": "Быстрая проверка: можете ли вы найти подлежащее?",
      "quiz_inline": {
        "question_ids": [
          "q6",
          "q7",
          "q8",
          "q9",
          "q10",
          "q25"
        ],
        "show_answers_immediately": true
      }
    },
    {
      "id": "b3_theory_verb",
      "type": "theory",
      "title": "Сказуемое — это часть предложения, которая показывает действие или состояние. Оно отвечает на вопрос «что делает?» или «что происходит?».",
      "theory": {
        "concept_id": "verb_identification",
        "content_md": "**Сказуемое** — это часть предложения, которая показывает действие или состояние. Оно отвечает на вопрос «что делает?» или «что происходит?».\n\nСказуемое стоит после подлежащего. Это может быть:\n- Обычный глагол: read, like, play, work\n- Глагол-связка: am, is, are (быть)\n- Глагол с вспомогательным словом: don't, doesn't, do, does",
        "key_points": [
          "Сказуемое показывает действие или состояние",
          "Стоит после подлежащего",
          "Может быть одним словом или группой слов",
          "Отвечает на вопрос 'что делает?' или 'что происходит?'"
        ],
        "common_mistakes": [
          {
            "wrong": "Пропуск глагола: 'I happy'",
            "right": "Нужен глагол-связка: 'I am happy'",
            "why": "В английском нужен глагол даже для описания состояния"
          }
        ],
        "examples": [
          {
            "id": "ex1",
            "text": "I read books.",
            "translation": "Я читаю книги.",
            "notes": "read — сказуемое (что делает?)",
            "tags": [
              "affirmative",
              "verb"
            ]
          },
          {
            "id": "ex2",
            "text": "She is a doctor.",
            "translation": "Она врач.",
            "notes": "is — сказуемое (глагол-связка)",
            "tags": [
              "affirmative",
              "verb"
            ]
          },
          {
            "id": "ex3",
            "text": "They play football.",
            "translation": "Они играют в футбол.",
            "notes": "play — сказуемое (что делают?)",
            "tags": [
              "affirmative",
              "verb"
            ]
          },